{
  "id": "air-quality/agricultural-burning-air-quality-south-asia",
  "title": "Agricultural Residue Burning Air Quality Impact In South Asia",
  "status": "scoped",
  "domain": ["air-quality", "public-health"],
  "region": ["south-asia"],
  "summary": "Build a verified workflow for measuring agricultural residue burning contribution to PM2.5 and health impact in South Asia.",
  "why_it_matters": "Build a verified workflow for measuring agricultural residue burning contribution to PM2.5 and health impact in South Asia.",
  "success_metrics": [
    {
      "metric": "Data traceability",
      "target": "Every claim links dated evidence with methodology.",
      "validation_method": "Schema validation and reviewer spot-checks."
    }
  ],
  "safety_level": "medium",
  "canonical_files": [
    "datasets.md",
    "evidence.json",
    "evidence.md",
    "outputs.md",
    "playbooks.md",
    "problem.json",
    "problem.md",
    "task-map.md",
    "tasks.json",
    "validation.md"
  ],
  "review_policy": {
    "required_reviews": 2,
    "replication_required": true,
    "merge_gate": "Schema validation, domain review, safety review, replication."
  }
}
