{"id":"food-security/livestock-disease-surveillance-east-africa","title":"Livestock Disease Surveillance And Pastoralist Livelihood Risk In East Africa","status":"scoped","domain":["food-security","public-health"],"region":["east-africa"],"summary":"Build a verified workflow for detecting livestock disease outbreaks and estimating pastoralist livelihood risk in East Africa, linking syndromic surveillance data, satellite-derived forage conditions, and market-price anomalies.","why_it_matters":"East Africa's pastoralists manage over 60 percent of the region's livestock, providing food and income for 20 million people. Diseases like Rift Valley fever, contagious bovine pleuropneumonia, and peste des petits ruminants can wipe out herds in weeks. Satellite-based forage monitoring exists but linking vegetation conditions to disease risk and market responses at actionable lead times is underdeveloped.","success_metrics":[{"metric":"Detection traceability","target":"Every disease-risk signal links surveillance, forage, and market data with methodology.","validation_method":"Schema validation and reviewer checks."}],"safety_level":"medium","canonical_files":["datasets.md","evidence.json","evidence.md","outputs.md","playbooks.md","problem.json","problem.md","task-map.md","tasks.json","validation.md"],"review_policy":{"required_reviews":2,"replication_required":true,"merge_gate":"Schema validation, domain review, safety review, replication."}}