{
  "id": "biodiversity/wetland-loss-migratory-birds-global",
  "title": "Wetland Loss Detection And Migratory Bird Population Impact",
  "status": "scoped",
  "domain": ["biodiversity", "climate-health"],
  "region": ["global"],
  "summary": "Build a verified workflow for detecting wetland loss and estimating migratory bird population impact using satellite-derived wetland maps and bird-count data.",
  "why_it_matters": "Build a verified workflow for detecting wetland loss and estimating migratory bird population impact using satellite-derived wetland maps and bird-count data.",
  "success_metrics": [
    {
      "metric": "Data traceability",
      "target": "Every claim links dated evidence with methodology.",
      "validation_method": "Schema validation and reviewer spot-checks."
    }
  ],
  "safety_level": "medium",
  "canonical_files": [
    "datasets.md",
    "evidence.json",
    "evidence.md",
    "outputs.md",
    "playbooks.md",
    "problem.json",
    "problem.md",
    "task-map.md",
    "tasks.json",
    "validation.md"
  ],
  "review_policy": {
    "required_reviews": 2,
    "replication_required": true,
    "merge_gate": "Schema validation, domain review, safety review, replication."
  }
}
