{"id":"public-health/drowning-prevention-south-asia","title":"Child Drowning Mortality And Supervision Gaps In South Asia","status":"scoped","domain":["public-health"],"region":["south-asia"],"summary":"Build a verified workflow for measuring child drowning mortality risk and supervision gaps in South Asia, linking survey data, water-body mapping, and childcare-access data at sub-national scale.","why_it_matters":"Drowning kills over 230,000 people annually, with children under five accounting for the highest rate. Over 90 percent of drowning deaths occur in LMICs, with South Asia having the highest absolute numbers — Bangladesh alone records over 14,000 child drowning deaths annually. Water-body proximity maps and childcare-access data exist but are not linked to drowning-mortality data at sub-national scale.","success_metrics":[{"metric":"Data integration","target":"Every drowning-risk estimate links survey, water-body, and childcare data with methodology.","validation_method":"Schema validation and reviewer checks."}],"safety_level":"medium","canonical_files":["datasets.md","evidence.json","evidence.md","outputs.md","playbooks.md","problem.json","problem.md","task-map.md","tasks.json","validation.md"],"review_policy":{"required_reviews":2,"replication_required":true,"merge_gate":"Schema validation, domain review, safety review, replication."}}